name,email,phone,address
Soundmatters Professionals Audio,soundmatters@rocketmail.com,+63 (32) 420 4292,"Plaridel Street, Paknaan, Mandaue City, Cebu"
Soundarium Pro Sounds & Lights Rental,soundarium@gmail.com,+63 (032) 420 2815,"Cebu North Road, Paknaan, Mandaue City 6014 Cebu"
Crystal Clear,solerex@solerex.com.ph,+63 (32) 344 8889,"M.L. Quezon Street, Maguikay, Mandaue City, Cebu"
Hikozoh Design Wood Furnishing,hikozohdesignwood@gmail.com,+63 (32) 383 0711,"2nd Floor Design Center Of Cebu, 356-A S. Fortuna corner P. Remedio Streets, Banilad, Mandaue City 6014 Cebu"
Snowbowls,snowbowlscreamery@gmail.com,nan,"2/F Parkmall, 168 Ouano Avenue, North Reclamation Area, Mandaue City 6014 Cebu"
Skylite Advertising Studio Co Inc,sales@skyliteadvertising.com,+63 (32) 326 4473,"Unit 108 Grand Arcade Buuilding, A.C. Cortes, Mandaue City, Cebu"
Skygo Marketing,skygo_marketing@yahoo.com,+63 (32) 420 2207,"Ac Cortez Avenue, Alang-Alang, Mandaue City, Cebu"
Sky Waterpark Cebu,info.skywaterpark@gmail.com,+63 (32) 345 1234,"6/F J Centre Mall, 165 A.S. Fortuna Street, Bakilid, Mandaue City 6014 Cebu"
Sky Cable,customercare.vis@skycable.com,+63 (32) 346 4255,"250 A.S. Fontana Street, Bakilid, Mandaue City, Cebu"
Skin Care Clinic,skincareclinic15@gmail.com,nan,"2/F Parkmall, 168 Ouano Avenue, North Reclamation Area, Mandaue City 6014 Cebu"
Skin 911 Facial & Slimming Centre,skin911.mainofc@gmail.com,+63 (32) 346 3699,"55 El Dorado Road, El Dorado Subdivision, Mandaue City 6014 Cebu"
