name,email,phone,address
Amazing Show,marketing@amazing-show.com,+63 (32) 834 8870,"Hadsan Cove Resort , Fuente Osmeña, Maribago, Lapu-Lapu City, Cebu"
Cebu's Original Lechon Belly,marlon@cebuslechonbelly.com,,"G/F SM Hypermarket, Maximo V. Patalinghug Jr. Avenue, Pueblo Verde, Lapu-Lapu City 6015 Cebu"
Cebu Website Design,inquire@cebuwebsitedesign.com,+63 (032) 266 0035,"B.12, L.37, Corinthians Subdivision, Basak, Lapu-Lapu City 6015 Cebu"
Cebu Metal Industries,cmi@globelines.com.ph,+63 (32) 495 8025,"Soong Center, Soong Mactan, Lapu-Lapu City, Cebu"
Cebu Electronics & Hobby Parts,lynx2004ad@gmail.com,+63 (32) 266 0035,"Blk 12, Lt 37, Corinthians Subd, Basak, Lapu-Lapu City 6015 Cebu"
Cebu Cabana Grill & Seafood Restaurant,cebucabana@gmail.com,+63 (966) 381 6072,"2/F The Mark Resort & Spa, Punta Engaño Road, Punta Engano, Lapu-Lapu City, Cebu"
Cebu Asia Vacation Tours,vacation-tours@yahoo.com,+63 (2) 3 495 9534,"No. 244 G. Y Dela Serna Street, Lapu-Lapu City, Cebu"
Capiz Shell Product,sales@capizshells.com,+63 (32) 236 8676,"Sudtunggan Road, Basak, Lapu-Lapu City, Cebu"
Cafe De France,info@cafedefrance.com.ph,+63 (32) 340 6938,"G/F, Block A, Mactan Marina Mall, 2nd Floor, Block A, Mactan Marina Mall MEPZ 1, Brgy. Ibo, Lapu-lapu City, Lapu-Lapu City 6015 Cebu"
